{
  "id": "e5a1c0de-0000-4000-8000-000000000001",
  "workflow_id": "6f1c2a4e-1111-4b8a-9a1b-123456789abc",
  "revision": 1,
  "title": "Create a repository in local Gitea",
  "voice": "en_US-ljspeech-medium",
  "size_bytes": null,
  "duration_ms": null,
  "download_url": null,
  "captions_url": null,
  "error": null,
  "created_at": "2026-11-01T10:00:00Z",
  "started_at": null,
  "finished_at": null,
  "preset": "landscape",
  "status": "queued",
  "progress": 0
}
