{
  "id": "e5a1c0de-0000-4000-8000-000000000003",
  "workflow_id": "6f1c2a4e-1111-4b8a-9a1b-123456789abc",
  "revision": 1,
  "title": "Create a repository in local Gitea",
  "voice": "en_US-ljspeech-medium",
  "size_bytes": 2457600,
  "duration_ms": 31733,
  "download_url": "/api/v1/exports/e5a1c0de-0000-4000-8000-000000000003/download",
  "captions_url": "/api/v1/exports/e5a1c0de-0000-4000-8000-000000000003/captions.vtt",
  "error": null,
  "created_at": "2026-11-01T10:00:00Z",
  "started_at": "2026-11-01T10:00:02Z",
  "finished_at": "2026-11-01T10:02:10Z",
  "preset": "landscape",
  "status": "ready",
  "progress": 100
}
